{
  "version": "v1-test",
  "generated_at": "2026-09-26T00:00:00Z",
  "count": 3,
  "license": "CC BY 4.0",
  "source": "https://github.com/DeadSno/brain-25-evidence",
  "endpoints": {
    "supplements": "/api/v1/supplements.json",
    "full_data": "/data.json"
  },
  "stats": {
    "grades": {
      "A": 1,
      "B": 1,
      "C": 0,
      "D": 1
    },
    "categories_atomic": {
      "Спорт": 1,
      "Иммунитет": 1,
      "Общее": 1
    },
    "categories_atomic_count": 3
  },
  "ids": [
    "Креатин",
    "Цинк",
    "PABA"
  ]
}
