{
  "version": "v1",
  "generated_at": "2026-10-14T16:56:28.927648+00:00",
  "count": 130,
  "license": "CC BY 4.0",
  "source": "https://github.com/DeadSno/brain-25-evidence",
  "endpoints": {
    "supplements": "/api/v1/supplements.json",
    "full_data": "/data.json"
  },
  "stats": {
    "grades": {
      "A": 8,
      "B": 45,
      "D": 25,
      "C": 52
    },
    "categories_atomic": {
      "Метаболизм": 20,
      "Когниция": 16,
      "Иммунитет": 15,
      "Общее": 12,
      "Спорт": 11,
      "Антиоксидант": 9,
      "Сердце": 7,
      "Сосуды": 7,
      "Сон": 7,
      "Неврология": 7,
      "Кости": 6,
      "Суставы": 6,
      "Психика": 5,
      "Воспаление": 4,
      "Кожа": 4,
      "Сексуальное здоровье": 4,
      "Кожа и суставы": 4,
      "Кровь": 3,
      "Стресс": 3,
      "ОРВИ": 3,
      "ЖКТ": 3,
      "Беременность": 3,
      "Кишечник": 3,
      "Нервная система": 2,
      "Адаптоген": 2,
      "Дети": 2,
      "Энергия": 2,
      "Выносливость": 2,
      "Депрессия": 2,
      "Печень": 2,
      "Мочеполовая система": 2,
      "Растения": 2,
      "Диабет": 2,
      "Настроение": 2,
      "сосуды": 2,
      "Минерал": 1,
      "Производительность": 1,
      "Память": 1,
      "Усталость": 1,
      "Инсульт": 1,
      "Деменция": 1,
      "Психиатрия": 1,
      "Циркадные ритмы": 1,
      "Нейромедиатор": 1,
      "Тревожность": 1,
      "Анемия": 1,
      "Остеоартрит": 1,
      "Волосы": 1,
      "Холестерин": 1,
      "Глаза": 1,
      "Зрение": 1,
      "Женское здоровье": 1,
      "СПКЯ": 1,
      "Старение": 1,
      "Почки": 1,
      "Грибы": 1,
      "Мышцы": 1,
      "Критические состояния": 1,
      "Гормоны": 1
    },
    "categories_combined": {
      "Общее": 12,
      "Когниция": 6,
      "Неврология/Метаболизм": 5,
      "Иммунитет": 5,
      "Кости/Иммунитет": 4,
      "Кожа и суставы": 4,
      "Метаболизм": 4,
      "Иммунитет/ОРВИ": 3,
      "Спорт": 3,
      "Кишечник": 3,
      "Когниция/Стресс": 2,
      "Когниция/Сосуды": 2,
      "Воспаление/Суставы": 2,
      "Психика/Сон": 2,
      "Психика/Депрессия": 2,
      "ЖКТ/Метаболизм": 2,
      "Мочеполовая система": 2,
      "Сердце/Растения": 2,
      "Метаболизм/Диабет": 2,
      "Настроение": 2,
      "Сон": 2,
      "Сердце/сосуды": 2,
      "Спорт/Когниция": 1,
      "Сердце": 1,
      "Нервная система/Кровь": 1,
      "Минерал/Сердце": 1,
      "Производительность": 1,
      "Когниция/Память": 1,
      "Когниция/Нервная система": 1,
      "Усталость/Адаптоген": 1,
      "Стресс/Адаптоген": 1,
      "Когниция/Дети": 1,
      "Когниция/Инсульт": 1,
      "Когниция/Деменция": 1,
      "Антиоксидант/Метаболизм": 1,
      "Антиоксидант/Психиатрия": 1,
      "Метаболизм/Антиоксидант": 1,
      "Сердце/Энергия": 1,
      "Сосуды/Антиоксидант": 1,
      "Сон/Циркадные ритмы": 1,
      "Нейромедиатор/Сон": 1,
      "Сон/Тревожность": 1,
      "Спорт/Выносливость": 1,
      "Спорт/Сосуды": 1,
      "Иммунитет/Антиоксидант": 1,
      "Кожа/Суставы": 1,
      "ЖКТ": 1,
      "Беременность/Кровь": 1,
      "Кровь/Анемия": 1,
      "Суставы/Остеоартрит": 1,
      "Антиоксидант/Неврология": 1,
      "Кожа/Волосы": 1,
      "Неврология/Спорт": 1,
      "Печень/Спорт": 1,
      "Сосуды/Беременность": 1,
      "Кости/Беременность": 1,
      "Суставы/Кожа": 1,
      "Сосуды/Метаболизм": 1,
      "Метаболизм/Холестерин": 1,
      "Глаза/Зрение": 1,
      "Женское здоровье/СПКЯ": 1,
      "Сексуальное здоровье/Энергия": 1,
      "Антиоксидант/Кожа": 1,
      "Печень": 1,
      "Иммунитет/Дети": 1,
      "Психика/Суставы": 1,
      "Сексуальное здоровье": 1,
      "Метаболизм/Сексуальное здоровье": 1,
      "Воспаление/Метаболизм": 1,
      "Сексуальное здоровье/Спорт": 1,
      "Старение/Метаболизм": 1,
      "Почки/Выносливость": 1,
      "Иммунитет/Грибы": 1,
      "Антиоксидант": 1,
      "Спорт/Мышцы": 1,
      "Критические состояния/Спорт": 1,
      "Кости/Сосуды": 1,
      "Антиоксидант/Воспаление": 1,
      "Гормоны": 1
    },
    "categories_atomic_count": 59
  },
  "ids": [
    "Креатин",
    "Омега-3",
    "Витамин D",
    "B12",
    "Магний",
    "Кофеин",
    "L-Теанин",
    "Бакопа",
    "Ежовик",
    "Гинкго",
    "Родиола",
    "Ашваганда",
    "Фосфатидилсерин",
    "Alpha-GPC",
    "CDP-холин",
    "Гуперзин А",
    "Куркумин",
    "Ресвератрол",
    "NAC",
    "Цинк",
    "Тирозин",
    "Таурин",
    "CoQ10",
    "Пикногенол",
    "Готу кола",
    "Мелатонин",
    "ГАБА",
    "Глицин",
    "Валериана",
    "Бета-аланин",
    "L-цитруллин",
    "Витамин C",
    "Эхинацея",
    "Бузина",
    "Зверобой",
    "5-HTP",
    "Коллаген",
    "Пробиотики",
    "B9",
    "Железо",
    "Триптофан",
    "Глюкозамин + хондроитин",
    "Витамин E",
    "Биотин",
    "L-карнитин",
    "BCAA",
    "Аргинин",
    "Кальций",
    "Гиалуроновая кислота",
    "Псиллиум",
    "Имбирь",
    "Чеснок",
    "Клюква",
    "Пустырник",
    "Боярышник",
    "Бета-глюканы овса",
    "Рибофлавин",
    "Лютеин + зеаксантин",
    "Инозитол",
    "Альфа-липоевая кислота",
    "D-манноза",
    "Мака",
    "Хром",
    "Астаксантин",
    "Расторопша",
    "Лактоферрин",
    "SAMe",
    "Йохимбин",
    "Пажитник",
    "Чёрный тмин",
    "Трибулус",
    "NMN",
    "Кордицепс",
    "Рейши",
    "Хлорофилл",
    "Сывороточный протеин",
    "Глутамин",
    "Босвеллия",
    "Витамин K2",
    "Берберин",
    "Кверцетин",
    "Шатавари",
    "Астрагал",
    "Шлемник",
    "Пассифлора",
    "Мелисса",
    "Лаванда",
    "Чага",
    "Шиитаке",
    "Глутатион",
    "PQQ",
    "Сульфорафан",
    "MSM",
    "Гимнема",
    "B1",
    "Холин",
    "EPA",
    "Витамин A",
    "B2",
    "B3",
    "B5",
    "B6",
    "Лизин",
    "Кремний",
    "HMB",
    "Карнозин",
    "Женьшень",
    "Селен",
    "Йод",
    "Молибден",
    "Витамин K1",
    "Ниацинамид",
    "Цистеин",
    "S. boulardii",
    "LGG",
    "B. lactis",
    "DHA",
    "GLA",
    "Медь",
    "Марганец",
    "Калий",
    "Бор",
    "Бетаин",
    "Метионин",
    "Орнитин",
    "Майтаке",
    "PABA",
    "Пролин",
    "Серин",
    "Аланин"
  ]
}
